{
  "$schema": "../schemas/kitchen.schema.json",
  "people": [
    {
      "id": "vitaly",
      "name": "Виталий",
      "avoid": [
        { "item": "Субпродукты", "level": "never", "note": "Кроме фуа-гра; куриный паштет из печени, скорее всего, тоже можно" },
        { "item": "Кролик", "level": "never" },
        { "item": "Речная и костлявая рыба", "level": "never" },
        { "item": "Брюссельская капуста", "level": "never" },
        { "item": "Тыква", "level": "never" },
        { "item": "Гречка", "level": "never" },
        { "item": "Шпинат", "level": "never" },
        { "item": "Целые яблоки", "level": "never", "note": "Нарезанные — в йогурте, кварке — можно" },
        { "item": "Бобы эдамаме", "level": "never" }
      ]
    },
    {
      "id": "sveta",
      "name": "Света",
      "avoid": [
        { "item": "Мясо и птица, кроме пяти видов", "level": "never", "note": "Ест только курицу, говядину, свинину, баранину и утку; индейку, кролика, субпродукты и дичь — нет" },
        { "item": "Речная и костлявая рыба", "level": "never" },
        { "item": "Острое", "level": "never" },
        { "item": "Гречка", "level": "never" },
        { "item": "Киви", "level": "never" },
        { "item": "Шпинат", "level": "never" },
        { "item": "Яйца всмятку", "level": "never" },
        { "item": "Бренд Pur Natur Biologische", "level": "dislike" }
      ]
    }
  ],
  "planRules": [
    {
      "title": "Главная идея",
      "rules": [
        "Ужин — уровня хорошего ресторана: человек с улицы не отличит его от блюда, которое при нём приготовил повар. Это обязательно: блюдо, которое после заморозки хоть немного проигрывает свежему, в ужин не ставим.",
        "Ужинаем вместе: одно блюдо на двоих, порции разные. Руками — не больше 10 минут: разогреть соус или мясо в сотейнике, обжарить, заправить свежим. Духовка или су-вид «поставил и забыл» могут идти дольше.",
        "Обед — только микроволновка, без другой техники: Виталий ест в офисе. Уровень — дорогая столовая, и по обеду тоже не должно быть понятно, что его замораживали.",
        "Блюдо — либо обед, либо ужин. Обед — всё в одном контейнере и хорош из микроволновки. Ужин — заготовка, которую доводят дома на плите, в духовке или су-виде.",
        "В ужин ничего не варим в кипятке — ни пасту, ни гарнир: много действий и несколько ожиданий. Гарнир ужина — из морозилки (пюре, гратен, чечевица) или без готовки: хороший хлеб, разогретый в духовке.",
        "Утром плиту включать можно — для завтрака: омлет, яичница, тости на сковороде."
      ]
    },
    {
      "title": "Ресторанный ужин",
      "rules": [
        "Берём то, что рестораны сами готовят заранее и лишь доводят при подаче: томлёное мясо (щёки, рёбра, голяшки), утиное конфи, соусы и супы, запечённую пасту и гратены, белок из су-вида. Чего ресторан заранее не делает — не делаем и мы.",
        "Нежный белок — утиную грудку, свиную вырезку, курицу, лосось — готовят в су-виде, остужают в ледяной воде и морозят в вакууме. Вечером — в ванну на ту же температуру, потом 1–2 минуты обжарить до корочки.",
        "Томлёное мясо морозят в его соусе, с желатином: при разогреве оно не сохнет. Корочку дают при подаче — кусок на сухую горячую сковороду или под гриль на 2–3 минуты.",
        "Мясо в соусе и гарнир не смешиваем: при разогреве гарнир размокнет. Гарнир — в вакуумном пакете в том же контейнере, греют его отдельно.",
        "Соус при подаче доводят как в ресторане: разогреть с ложкой воды или бульона, вмешать кусочек холодного сливочного масла — вернутся блеск и плотность, — капнуть лимона или уксуса, проверить соль.",
        "Тарелка ужина — как в ресторане: соус, белок, гарнир, кислота (маринованный лук, каперсы, лимон), хруст (поджаренные орехи, панграттато, жареный лук) и свежая зелень. Хрустящее хранят в банке, не в морозилке.",
        "Морозить быстро и без воздуха — в вакуумном пакете или слоем до 5 см: чем быстрее замёрзло, тем мельче кристаллы льда и тем меньше блюдо отличается от свежего.",
        "Ужин размораживают в холодильнике с вечера накануне: оттаявшее греется ровно и быстро. Тарелки подогревают — на холодной тарелке горячее остывает за минуту.",
        "Новое для нас ужинное блюдо сначала пробуем: одну порцию заморозить и через несколько дней разогреть по инструкции. Отличается от свежего — в ужин не ставим."
      ]
    },
    {
      "title": "Меню и закупка",
      "rules": [
        "Живём в Нидерландах: опираемся на то, что там продаётся, и берём по максимуму сезонные местные овощи и фрукты.",
        "Если понятно, на какой месяц составлена техкарта (из названия или дат), — стараться брать овощи, сезонные именно в этом месяце.",
        "Кухня блюд любая, не обязательно нидерландская. Блюда должны быть максимально вкусными: из каталога брать идеи, а технику и пропорции — по классическим рецептам этих блюд.",
        "Вкус — на уровне ресторана или лучше.",
        "Морскую рыбу (филе без костей) и морепродукты — можно.",
        "В закупке у каждого продукта в заметке — голландское название (kippendijfilet, knolselderij…), чтобы проще найти в магазине.",
        "Закупок две. Первая — к дню готовки: всё для блюд в заморозку; готовим когда удобно, а едим через 1–2 недели. Вторая — когда начинаем есть партию: завтраки, перекусы и свежее к подаче.",
        "Во второй закупке на вторую неделю — только то, что долго хранится или замораживается в день покупки."
      ]
    },
    {
      "title": "Вкус и качество",
      "rules": [
        "Вкус важнее удобства. Если таймлайн, плита или место мешают сделать блюдо как следует, меняем блюдо на другое, а не упрощаем технику: не пропускаем обжарку, не кладём тесно, не сокращаем томление.",
        "Соль — в граммах на каждое блюдо и гарнир: 0,8–1 % от массы готового, с поправкой на бульон, сыр, оливки и каперсы. Вода для пасты и картофеля — 10 г на литр. Мясо и птицу солить сразу после нарезки.",
        "Соль в шагах — только граммами, без «посолить» и «щепотки»: в прошлый раз рис, полента, паста и курица с картофелем получили 0,3–0,4 % вместо 0,8–1 %, а остальное солили на глаз.",
        "Соль отвешивают заранее: в блоке нарезки помощник взвешивает на ювелирных весах соль для каждого места, где она нужна, в мелкие подписанные миски — «Рис — 30 г». В шаге — «высыпать миску „Рис“»; у плиты соль не мерят.",
        "Перед фасовкой каждое блюдо пробуют — отдельным шагом: соль, кислота, перец, густота соуса. Готовность — по признаку (мясо разваливается под ложкой, температура щупа), а не по таймеру; в шаге — что делать, если не готово.",
        "Шаг пробы говорит, сколько добавить, если пресно: «+5 г соли на кастрюлю, размешать, попробовать снова».",
        "Мясо, птицу и фарш для рагу и запекания сначала обжаривают до тёмной корочки — партиями, в один слой с зазором, отдельно от овощей: в тесноте мясо тушится в соке и сереет. Румянят на металле, не в стекле.",
        "Грибы обжаривают отдельно, на сильном огне до золотистого цвета, и вмешивают в конце. Овощи в долгом тушении режут крупно или кладут за 40–60 минут до конца, иначе они разварятся.",
        "В заморозку — блюда, которым повторный нагрев не вредит: тушёное мясо, рагу, супы, запеканки. Не замораживать пасту, смешанную с соусом, картофель кусками и приготовленные зелёные овощи.",
        "Поленту не готовим: после заморозки и разогрева она комкается и не становится кремовой.",
        "Паста на заморозку — только запечённая: лазанья, паста аль форно. Зелёные овощи — покупные замороженные (diepvries) или бланшированные 1–2 минуты и остуженные в ледяной воде: доготовятся при разогреве.",
        "Свежее — при подаче, не в заморозку: лимонный сок, рубленую зелень и хорошее оливковое масло добавляют после разогрева. Техкарта их закупает, а рацион говорит, чем и сколько заправить.",
        "Микроволновка — на 50–70 % мощности, примерно вдвое дольше, с перемешиванием на середине и минутой под крышкой в конце: на полной мощности края пересыхают, а мясо становится резиновым. В рационе — мощность.",
        "Щуп — у всего, что запекают: куриное бедро — 80–85 °C, грудка — 65 °C, лосось — 48–50 °C в центре.",
        "Бульон — фонд из бутылки или банки (kalfsfond, runderfond, kippenfond), не кубики. В тушёное мясо и соусы — ≈ 7 г желатина на 500 мл жидкости: соус станет плотным и глянцевым.",
        "Рыбу замораживают сырой, без соли и зелени, в вакуумном пакете, а не в плёнке; солят и приправляют перед духовкой. Филе с пометкой ontdooid уже размораживали — его не берём, берём свежее или замороженное (diepvries)."
      ]
    },
    {
      "title": "Питание",
      "rules": [
        "Виталий: 2500 ккал и 180 г белка в день.",
        "Виталий добирает белок и калории протеиновым коктейлем: один в день за раз — 60 г протеина на 500 мл соевого молока. Его калории и белок входят в дневной итог.",
        "Света: 1800 ккал и не больше 100 г белка в день.",
        "Следить за балансом витаминов и минералов: каждого должно быть достаточно, без перекоса в одни и те же продукты."
      ]
    },
    {
      "title": "Приёмы пищи",
      "rules": [
        "Одна техкарта — на две недели: 7 дней, завтраки, обеды, ужины и перекусы для обоих.",
        "5–6 разных основных блюд, обеды и ужины — разные блюда.",
        "Виталий берёт обед на работу в контейнере, размер контейнера указывает техкарта. На работе есть микроволновка и холодильник.",
        "Света обедает дома.",
        "Перекусов — не больше трёх в день, по времени: после завтрака, после обеда и после ужина. Если позиций больше — объединять их в эти три.",
        "Первый перекус, обед и второй перекус Виталия — на работе. Туда — то, что легко взять с собой и почти не нужно готовить; что надо готовить или держать в холодильнике — на вечерний перекус дома.",
        "Всё, что надо разморозить к следующему дню, — пунктом в конце предыдущего дня: вечером из морозилки в холодильник.",
        "Завтраки можно заготовить, а можно просто расписать, что есть, и закупить продукты.",